{
  "tech_stack": {
    "frontend": null,
    "backend": "FastAPI",
    "database": null,
    "auth": null
  },
  "architecture": {
    "pattern": null,
    "data_isolation": null,
    "ai_integration": null
  },
  "conventions": {
    "naming": null,
    "file_structure": null,
    "state_management": null
  },
  "schemas": {},
  "integration_points": []
}