{
  "tech_stack": {
    "frontend": null,
    "backend": null,
    "database": null,
    "auth": null
  },
  "architecture": {
    "pattern": "feature-based",
    "data_isolation": null,
    "ai_integration": null
  },
  "conventions": {
    "naming": null,
    "file_structure": "layer-based",
    "state_management": null
  },
  "schemas": {},
  "integration_points": []
}